{
  "schema_version": "evaluation-corpus-v1",
  "corpus_version": "evaluation-corpus-v1",
  "frozen_at": "2026-07-25T16:26:00.871005Z",
  "selection_method": "Public GitHub issue-only search frame; sorted deterministic sample of eight issues per repository using seed 20260725. encode/httpx was excluded before freeze because its initial captured repository frame had fewer than eight eligible issues; pytest-dev/pytest replaced it before any system run.",
  "inclusion_rules": [
    "Public issue",
    "repository supports pytest",
    "default-branch revision pinned at capture"
  ],
  "exclusion_rules": [
    "Pull request",
    "private or restricted issue",
    "unavailable pinned revision",
    "repository frame with fewer than eight eligible issues"
  ],
  "strata": [
    "repository",
    "issue_type",
    "state_at_capture"
  ],
  "cases": [
    {
      "case_id": "psf-requests-7048",
      "repository": "psf/requests",
      "issue_number": 7048,
      "issue_url": "https://github.com/psf/requests/issues/7048",
      "revision_sha": "69f84847045bef7a849cc994a26fe7ba8a169e95",
      "issue_type": "incomplete_or_needs_info",
      "state_at_capture": "closed",
      "selection_stratum": "psf/requests"
    },
    {
      "case_id": "psf-requests-7118",
      "repository": "psf/requests",
      "issue_number": 7118,
      "issue_url": "https://github.com/psf/requests/issues/7118",
      "revision_sha": "69f84847045bef7a849cc994a26fe7ba8a169e95",
      "issue_type": "ambiguous_or_mixed",
      "state_at_capture": "closed",
      "selection_stratum": "psf/requests"
    },
    {
      "case_id": "psf-requests-7154",
      "repository": "psf/requests",
      "issue_number": 7154,
      "issue_url": "https://github.com/psf/requests/issues/7154",
      "revision_sha": "69f84847045bef7a849cc994a26fe7ba8a169e95",
      "issue_type": "feature_request",
      "state_at_capture": "closed",
      "selection_stratum": "psf/requests"
    },
    {
      "case_id": "psf-requests-7164",
      "repository": "psf/requests",
      "issue_number": 7164,
      "issue_url": "https://github.com/psf/requests/issues/7164",
      "revision_sha": "69f84847045bef7a849cc994a26fe7ba8a169e95",
      "issue_type": "ambiguous_or_mixed",
      "state_at_capture": "closed",
      "selection_stratum": "psf/requests"
    },
    {
      "case_id": "psf-requests-7271",
      "repository": "psf/requests",
      "issue_number": 7271,
      "issue_url": "https://github.com/psf/requests/issues/7271",
      "revision_sha": "69f84847045bef7a849cc994a26fe7ba8a169e95",
      "issue_type": "feature_request",
      "state_at_capture": "closed",
      "selection_stratum": "psf/requests"
    },
    {
      "case_id": "psf-requests-7324",
      "repository": "psf/requests",
      "issue_number": 7324,
      "issue_url": "https://github.com/psf/requests/issues/7324",
      "revision_sha": "69f84847045bef7a849cc994a26fe7ba8a169e95",
      "issue_type": "ambiguous_or_mixed",
      "state_at_capture": "closed",
      "selection_stratum": "psf/requests"
    },
    {
      "case_id": "psf-requests-7456",
      "repository": "psf/requests",
      "issue_number": 7456,
      "issue_url": "https://github.com/psf/requests/issues/7456",
      "revision_sha": "69f84847045bef7a849cc994a26fe7ba8a169e95",
      "issue_type": "feature_request",
      "state_at_capture": "closed",
      "selection_stratum": "psf/requests"
    },
    {
      "case_id": "psf-requests-7594",
      "repository": "psf/requests",
      "issue_number": 7594,
      "issue_url": "https://github.com/psf/requests/issues/7594",
      "revision_sha": "69f84847045bef7a849cc994a26fe7ba8a169e95",
      "issue_type": "ambiguous_or_mixed",
      "state_at_capture": "closed",
      "selection_stratum": "psf/requests"
    },
    {
      "case_id": "openai-openai-python-2919",
      "repository": "openai/openai-python",
      "issue_number": 2919,
      "issue_url": "https://github.com/openai/openai-python/issues/2919",
      "revision_sha": "d4c151d92ba713e56518a4483d3b7918dd1be838",
      "issue_type": "environment_setup",
      "state_at_capture": "open",
      "selection_stratum": "openai/openai-python"
    },
    {
      "case_id": "openai-openai-python-3011",
      "repository": "openai/openai-python",
      "issue_number": 3011,
      "issue_url": "https://github.com/openai/openai-python/issues/3011",
      "revision_sha": "d4c151d92ba713e56518a4483d3b7918dd1be838",
      "issue_type": "confirmable_bug_report",
      "state_at_capture": "open",
      "selection_stratum": "openai/openai-python"
    },
    {
      "case_id": "openai-openai-python-3248",
      "repository": "openai/openai-python",
      "issue_number": 3248,
      "issue_url": "https://github.com/openai/openai-python/issues/3248",
      "revision_sha": "d4c151d92ba713e56518a4483d3b7918dd1be838",
      "issue_type": "ambiguous_or_mixed",
      "state_at_capture": "closed",
      "selection_stratum": "openai/openai-python"
    },
    {
      "case_id": "openai-openai-python-3258",
      "repository": "openai/openai-python",
      "issue_number": 3258,
      "issue_url": "https://github.com/openai/openai-python/issues/3258",
      "revision_sha": "d4c151d92ba713e56518a4483d3b7918dd1be838",
      "issue_type": "ambiguous_or_mixed",
      "state_at_capture": "closed",
      "selection_stratum": "openai/openai-python"
    },
    {
      "case_id": "openai-openai-python-3294",
      "repository": "openai/openai-python",
      "issue_number": 3294,
      "issue_url": "https://github.com/openai/openai-python/issues/3294",
      "revision_sha": "d4c151d92ba713e56518a4483d3b7918dd1be838",
      "issue_type": "confirmable_bug_report",
      "state_at_capture": "open",
      "selection_stratum": "openai/openai-python"
    },
    {
      "case_id": "openai-openai-python-3313",
      "repository": "openai/openai-python",
      "issue_number": 3313,
      "issue_url": "https://github.com/openai/openai-python/issues/3313",
      "revision_sha": "d4c151d92ba713e56518a4483d3b7918dd1be838",
      "issue_type": "ambiguous_or_mixed",
      "state_at_capture": "open",
      "selection_stratum": "openai/openai-python"
    },
    {
      "case_id": "openai-openai-python-3338",
      "repository": "openai/openai-python",
      "issue_number": 3338,
      "issue_url": "https://github.com/openai/openai-python/issues/3338",
      "revision_sha": "d4c151d92ba713e56518a4483d3b7918dd1be838",
      "issue_type": "confirmable_bug_report",
      "state_at_capture": "open",
      "selection_stratum": "openai/openai-python"
    },
    {
      "case_id": "openai-openai-python-3464",
      "repository": "openai/openai-python",
      "issue_number": 3464,
      "issue_url": "https://github.com/openai/openai-python/issues/3464",
      "revision_sha": "d4c151d92ba713e56518a4483d3b7918dd1be838",
      "issue_type": "ambiguous_or_mixed",
      "state_at_capture": "closed",
      "selection_stratum": "openai/openai-python"
    },
    {
      "case_id": "pydantic-pydantic-13030",
      "repository": "pydantic/pydantic",
      "issue_number": 13030,
      "issue_url": "https://github.com/pydantic/pydantic/issues/13030",
      "revision_sha": "a2a6577d4c329dd574a45dbb01a8feaa16b1ad3d",
      "issue_type": "confirmable_bug_report",
      "state_at_capture": "closed",
      "selection_stratum": "pydantic/pydantic"
    },
    {
      "case_id": "pydantic-pydantic-13113",
      "repository": "pydantic/pydantic",
      "issue_number": 13113,
      "issue_url": "https://github.com/pydantic/pydantic/issues/13113",
      "revision_sha": "a2a6577d4c329dd574a45dbb01a8feaa16b1ad3d",
      "issue_type": "feature_request",
      "state_at_capture": "open",
      "selection_stratum": "pydantic/pydantic"
    },
    {
      "case_id": "pydantic-pydantic-13136",
      "repository": "pydantic/pydantic",
      "issue_number": 13136,
      "issue_url": "https://github.com/pydantic/pydantic/issues/13136",
      "revision_sha": "a2a6577d4c329dd574a45dbb01a8feaa16b1ad3d",
      "issue_type": "environment_setup",
      "state_at_capture": "closed",
      "selection_stratum": "pydantic/pydantic"
    },
    {
      "case_id": "pydantic-pydantic-13169",
      "repository": "pydantic/pydantic",
      "issue_number": 13169,
      "issue_url": "https://github.com/pydantic/pydantic/issues/13169",
      "revision_sha": "a2a6577d4c329dd574a45dbb01a8feaa16b1ad3d",
      "issue_type": "feature_request",
      "state_at_capture": "open",
      "selection_stratum": "pydantic/pydantic"
    },
    {
      "case_id": "pydantic-pydantic-13236",
      "repository": "pydantic/pydantic",
      "issue_number": 13236,
      "issue_url": "https://github.com/pydantic/pydantic/issues/13236",
      "revision_sha": "a2a6577d4c329dd574a45dbb01a8feaa16b1ad3d",
      "issue_type": "feature_request",
      "state_at_capture": "closed",
      "selection_stratum": "pydantic/pydantic"
    },
    {
      "case_id": "pydantic-pydantic-13327",
      "repository": "pydantic/pydantic",
      "issue_number": 13327,
      "issue_url": "https://github.com/pydantic/pydantic/issues/13327",
      "revision_sha": "a2a6577d4c329dd574a45dbb01a8feaa16b1ad3d",
      "issue_type": "confirmable_bug_report",
      "state_at_capture": "open",
      "selection_stratum": "pydantic/pydantic"
    },
    {
      "case_id": "pydantic-pydantic-13360",
      "repository": "pydantic/pydantic",
      "issue_number": 13360,
      "issue_url": "https://github.com/pydantic/pydantic/issues/13360",
      "revision_sha": "a2a6577d4c329dd574a45dbb01a8feaa16b1ad3d",
      "issue_type": "feature_request",
      "state_at_capture": "open",
      "selection_stratum": "pydantic/pydantic"
    },
    {
      "case_id": "pydantic-pydantic-13471",
      "repository": "pydantic/pydantic",
      "issue_number": 13471,
      "issue_url": "https://github.com/pydantic/pydantic/issues/13471",
      "revision_sha": "a2a6577d4c329dd574a45dbb01a8feaa16b1ad3d",